{
  "$schema": "https://json-schema.org/draft/2020-12/schema",
  "title": "Phi Lexicon Entry",
  "type": "object",
  "properties": {
    "word": {
      "type": "string",
      "minLength": 1,
      "pattern": "^[a-z]+$",
      "description": "The Phi word."
    },
    "gloss": {
      "type": "string",
      "minLength": 1,
      "description": "A concise, 1-2 word English gloss or a Leipzig abbreviation for grammatical particles."
    },
    "ipa": {
      "type": "string",
      "minLength": 3,
      "pattern": "^/.+/$",
      "description": "The International Phonetic Alphabet transcription with stress marks and syllable breaks."
    },
    "syllables": {
      "type": "array",
      "items": {
        "type": "string",
        "pattern": "^(?:(?:ph|th|sh|wh|[hklmnprstw])?[aeiou])$"
      },
      "minItems": 1,
      "maxItems": 3,
      "uniqueItems": true,
      "description": "The canonical syllable sequence, with onset-vowel syllables and hiatus vowels stored separately."
    },
    "slot": {
      "type": "integer",
      "enum": [0, 1, 2],
      "description": "The particle's position in the three-slot system. This field appears only on particles."
    },
    "slot1_rank": {
      "type": "string",
      "enum": [
        "tense",
        "aspect",
        "voice",
        "evidentiality",
        "modality",
        "negation"
      ],
      "description": "The particle's category in canonical Slot 1 stacking order. This field appears only on Slot 1 particles."
    },
    "pos": {
      "type": "string",
      "enum": [
        "noun",
        "verb",
        "adjective",
        "numeral",
        "particle",
        "preposition",
        "pronoun",
        "conjunction",
        "complementizer",
        "interrogative",
        "discourse",
        "classifier",
        "quantifier",
        "vocative",
        "interjection"
      ],
      "description": "The entry's single lexical class. Rule-supplied uses, such as an event noun formed from a verb, do not add another class."
    },
    "search_terms": {
      "type": "array",
      "items": {
        "type": "string",
        "minLength": 1
      },
      "minItems": 1,
      "uniqueItems": true,
      "description": "Optional English synonyms or lookup terms not already supplied by the gloss."
    },
    "description": {
      "type": "string",
      "minLength": 1,
      "description": "The word's meaning and range of use, with the nearby distinction a speaker is most likely to need."
    },
    "articulatory_notes": {
      "type": "string",
      "minLength": 1,
      "description": "How the complete word is physically articulated, with relevant contact, airflow, stress, and hiatus."
    },
    "sound_symbolism": {
      "type": "string",
      "minLength": 1,
      "description": "An optional Phi-specific sound-meaning association stated as phonesthetic interpretation rather than universal fact or hidden morphology."
    },
    "usage_notes": {
      "type": "string",
      "minLength": 1,
      "description": "Optional syntax, contrasts, collocations, or usage guidance not evident from the definition and examples."
    },
    "examples": {
      "type": "array",
      "items": {
        "type": "object",
        "properties": {
          "phi": {
            "type": "string",
            "minLength": 1,
            "pattern": "^[a-z]+(?: [a-z]+)*\\.(?: [a-z]+(?: [a-z]+)*\\.)*$",
            "description": "One or more complete Phi sentences using periods as their only punctuation."
          },
          "translation": {
            "type": "string",
            "minLength": 1,
            "description": "A natural English translation of the Phi example."
          }
        },
        "required": ["phi", "translation"],
        "additionalProperties": false
      },
      "minItems": 1,
      "uniqueItems": true,
      "description": "Worked examples that use the entry word, stored separately from usage commentary so they can be validated and rendered directly."
    },
    "pillars": {
      "type": "object",
      "properties": {
        "solarpunk-values": {
          "type": "string",
          "minLength": 1,
          "description": "A specific direct connection between this word and solarpunk values."
        },
        "secular-buddhist-philosophy": {
          "type": "string",
          "minLength": 1,
          "description": "A specific direct connection between this word and secular Buddhist philosophy."
        },
        "art-nouveau-aesthetics": {
          "type": "string",
          "minLength": 1,
          "description": "A specific direct connection between this word and Art Nouveau aesthetics."
        },
        "peace-linguistics-practices": {
          "type": "string",
          "minLength": 1,
          "description": "A specific direct connection between this word and peace linguistics practices."
        },
        "pre-industrial-wisdom": {
          "type": "string",
          "minLength": 1,
          "description": "A specific direct connection between this word and pre-industrial wisdom."
        }
      },
      "minProperties": 1,
      "additionalProperties": false,
      "description": "Optional direct connections between this word and Phi's philosophical pillars, with a specific rationale for each."
    },
    "semantic_domains": {
      "type": "object",
      "propertyNames": {
        "enum": [
          "nature",
          "physical",
          "spatial",
          "temporal",
          "quantity",
          "activity",
          "creation",
          "cognition",
          "wisdom",
          "emotion",
          "communication",
          "community",
          "ethics",
          "aesthetic",
          "ritual"
        ]
      },
      "additionalProperties": {
        "type": "string",
        "minLength": 1
      },
      "minProperties": 1,
      "description": "Semantic browse routes with brief rationales explaining why a speaker would expect to find this word in each domain."
    },
    "modules": {
      "type": "array",
      "items": {
        "type": "string",
        "enum": [
          "household-and-daily-life",
          "medical-and-bodily-care",
          "systems-and-shared-infrastructure",
          "philosophical-reasoning",
          "accessibility-and-participation",
          "commons-and-collective-governance",
          "ecological-systems-and-material-life",
          "work-craft-and-repair"
        ]
      },
      "minItems": 1,
      "maxItems": 8,
      "uniqueItems": true,
      "description": "Optional learning paths in which a content word belongs. Several paths may share the same word."
    }
  },
  "required": [
    "word",
    "gloss",
    "ipa",
    "syllables",
    "pos",
    "description",
    "articulatory_notes",
    "examples"
  ],
  "additionalProperties": false,
  "allOf": [
    {
      "if": {
        "properties": {
          "pos": {
            "const": "particle"
          }
        },
        "required": ["pos"]
      },
      "then": {
        "required": ["slot"]
      },
      "else": {
        "not": {
          "anyOf": [
            {
              "required": ["slot"]
            },
            {
              "required": ["slot1_rank"]
            }
          ]
        }
      }
    },
    {
      "if": {
        "properties": {
          "pos": {
            "const": "particle"
          },
          "slot": {
            "const": 1
          }
        },
        "required": ["pos", "slot"]
      },
      "then": {
        "required": ["slot1_rank"]
      },
      "else": {
        "not": {
          "required": ["slot1_rank"]
        }
      }
    },
    {
      "if": {
        "properties": {
          "pos": {
            "enum": [
              "noun",
              "verb",
              "adjective",
              "numeral"
            ]
          }
        },
        "required": ["pos"]
      },
      "then": {
        "required": ["semantic_domains"]
      },
      "else": {
        "not": {
          "anyOf": [
            {
              "required": ["semantic_domains"]
            },
            {
              "required": ["modules"]
            }
          ]
        }
      }
    }
  ]
}
