{
  "word": "thilou",
  "gloss": "inquire",
  "ipa": "/θi.ˈlo̞.u/",
  "syllables": [
    "thi",
    "lo",
    "u"
  ],
  "pos": "verb",
  "search_terms": [
    "ask",
    "seek information"
  ],
  "description": "When someone asks in order to obtain information or test what is understood, the verb is 'thilou'. It suits a question about the weather as readily as one about a difficult argument. The sentence particle 'wa' marks a direct question; 'thilou' names the act of inquiry and can also take an embedded question.",
  "articulatory_notes": "Rest the tongue tip lightly against the upper teeth for unvoiced 'th', let air pass along it, and release into high-front unrounded 'i'. Touch the tongue tip to the alveolar ridge for 'l' and shape stressed rounded true-mid back 'o'. Let final high-back rounded 'u' form its own hiatus syllable.",
  "sound_symbolism": "The final two rounded vowels remain separate rather than closing into a glide. That small opening at the end can help a learner remember a question left for another person to answer.",
  "usage_notes": "Direct yes-or-no questions begin with 'wa'; their embedded counterparts use 'pha ... pho'. Content questions retain the appropriate interrogative. In noun position, 'thilou' is an inquiry.",
  "examples": [
    {
      "phi": "mia pha thia towe nai pho thilou.",
      "translation": "I inquire whether you are well."
    }
  ],
  "pillars": {
    "secular-buddhist-philosophy": "An inquiry gives not-knowing a grammatical place. A speaker can ask before turning an impression into a settled view.",
    "peace-linguistics-practices": "A question offers a turn for checking what another person meant before disagreement or blame is attributed."
  },
  "semantic_domains": {
    "cognition": "seeking information where knowledge is incomplete",
    "communication": "putting a question to another person"
  }
}
