{
  "word": "shelomu",
  "gloss": "understand",
  "ipa": "/ʃe̞.ˈlo̞.mu/",
  "syllables": [
    "she",
    "lo",
    "mu"
  ],
  "pos": "verb",
  "search_terms": [
    "comprehend",
    "grasp meaning"
  ],
  "description": "A learner may repeat every step of a method and still not 'shelomu' why it works. Understanding grasps the meaning or relation that connects those steps. 'sano' (know) reports the stored instructions or long familiarity with them.",
  "articulatory_notes": "Raise the tongue blade towards the postalveolar region for voiceless 'sh' and pass air through the narrow channel into true-mid front 'e'. Touch the tongue tip to the alveolar ridge for lateral 'l' and shape stressed rounded true-mid back 'o'. Close the lips for voiced nasal 'm', carry the voice through the nose, and finish with high-back rounded 'u'.",
  "usage_notes": "'shelomu' takes the material understood as a direct object. A proposition instead uses 'tha ... tho'. An embedded question takes 'pha ... pho', and a content question keeps its gap-word inside the frame. In noun position, 'shelomu' is understanding.",
  "examples": [
    {
      "phi": "mia thena shelomu.",
      "translation": "I understand the thing."
    }
  ],
  "pillars": {
    "secular-buddhist-philosophy": "Experience provides a test for understanding; a collection of correct phrases does not.",
    "peace-linguistics-practices": "Understanding another person's account and agreeing with it are separate acts. 'shelomu' reports the first."
  },
  "semantic_domains": {
    "cognition": "meaning or relation grasped among facts, parts, or events",
    "communication": "comprehension of another person's words or account"
  }
}
