{
  "word": "phomila",
  "gloss": "offspring",
  "ipa": "/ɸo̞.ˈmi.lä/",
  "syllables": [
    "pho",
    "mi",
    "la"
  ],
  "pos": "noun",
  "search_terms": [
    "child by descent",
    "progeny"
  ],
  "description": "Someone remains a person's 'phomila', or offspring, regardless of their present age. 'lopia' (child) describes childhood, while 'lumira' (descendant) can reach through more than one generation. The relation is descent rather than possession.",
  "articulatory_notes": "Bring the lips close for unvoiced 'ph' and push air through the narrow opening, then round them for middle-height back 'o'. Close the lips for voiced 'm', let the sound resonate through the nose, and release into stressed high-front unrounded 'i'. Touch the tongue tip to the alveolar ridge for voiced 'l', let air pass along its sides, and finish with open central 'a'.",
  "usage_notes": "Place the parent or earlier relative before 'phomila' to show whose offspring is meant. Use 'lo' for an explicit plural. The noun can refer to an adult offspring; use 'lopia' when the childhood stage is the point.",
  "examples": [
    {
      "phi": "mia lo phomila welira.",
      "translation": "My offspring thrive."
    }
  ],
  "pillars": {
    "solarpunk-values": "Calling future people 'phomila' brings them into a living line of descent. A present decision can state what reaches them instead of praising the future in general."
  },
  "semantic_domains": {
    "community": "a person's direct relation to the next generation in a family line",
    "temporal": "offspring continue a line beyond the parent's generation"
  }
}
