{
  "word": "phea",
  "gloss": "AS",
  "ipa": "/ˈɸe̞.ä/",
  "syllables": [
    "phe",
    "a"
  ],
  "pos": "preposition",
  "search_terms": [
    "as",
    "like",
    "in the manner of"
  ],
  "description": "'phea' lets a child's song take a bird as its model. It expresses likeness or manner while keeping the two things distinct; it can also frame a relationship, as in people acting as siblings. A measured or ranked comparison instead uses 'sheo' (THAN).",
  "articulatory_notes": "Bring the lips close without sealing them and pass unvoiced air through the gap for 'ph', then spread them for middle-height front 'e'. The jaw lowers into open central 'a' for the separate second syllable. Stress 'phe'.",
  "examples": [
    {
      "phi": "lopia phea pelori meliho.",
      "translation": "The child sings like a bird."
    }
  ]
}
