{
  "word": "sano",
  "gloss": "know",
  "ipa": "/ˈsä.n̪o̞/",
  "syllables": [
    "sa",
    "no"
  ],
  "pos": "verb",
  "search_terms": [
    "have knowledge",
    "be familiar with"
  ],
  "description": "'sano' says that someone has information, an answer, familiarity with a person, or practical command of a method. A neighbour may know who left yet not understand why, and a craftsperson may know a method through years of use. 'shelomu' (understand) is about meaning and relations; 'nohero' (believe) is about what someone holds true.",
  "articulatory_notes": "Hold the tongue close to the alveolar ridge and direct voiceless air through a narrow groove for 's', then open into stressed central 'a'. Place the tongue tip against the back of the upper teeth for dental 'n', continue voicing through the nose, and release into rounded true-mid back 'o'.",
  "usage_notes": "A person, thing, or method may be a direct object. A known proposition takes 'tha ... tho'; embedded yes or no questions and content questions follow Phi's ordinary complement-clause patterns. In noun position, 'sano' is knowledge.",
  "examples": [
    {
      "phi": "mia thia sano.",
      "translation": "I know you."
    },
    {
      "phi": "mia tha shia to wepu tho sano.",
      "translation": "I know that they left."
    }
  ],
  "pillars": {
    "secular-buddhist-philosophy": "With 'sano', a person may state knowledge while Phi's evidentials keep its claimed source available for examination and revision.",
    "peace-linguistics-practices": "Separating knowledge from understanding gives disagreement a precise starting point: one person may know that an event occurred and still ask why.",
    "pre-industrial-wisdom": "A method learned through repeated work is knowledge even when it has no written account."
  },
  "semantic_domains": {
    "cognition": "information, a person, a method, or an answer held in present knowledge",
    "community": "familiarity with people and knowledge held or exchanged within a group"
  }
}
