{
  "word": "halemu",
  "gloss": "remember",
  "ipa": "/hä.ˈle̞.mu/",
  "syllables": [
    "ha",
    "le",
    "mu"
  ],
  "pos": "verb",
  "search_terms": [
    "recall",
    "memory"
  ],
  "description": "A name returning halfway through a conversation and a childhood event that never quite left are both work for 'halemu'. The verb covers something from the past remaining in or returning to present memory. 'miratu' (recognize) begins with something encountered now and connects it to prior knowledge; remembering may also begin from within, before anything new is encountered.",
  "articulatory_notes": "Let unvoiced air pass freely through the open glottis for 'h', then shape open central 'a'. Touch the tongue tip to the alveolar ridge for lateral 'l' and release into stressed true-mid front 'e'. Close the lips for voiced nasal 'm', carry the voice through the nose, and finish with high-back rounded 'u'.",
  "usage_notes": "Remembered content is a direct object; a proposition fits within 'tha ... tho'. Causative 'ka halemu' means that someone or something brings the memory back. In noun position, 'halemu' is remembering or a memory.",
  "examples": [
    {
      "phi": "mia thena halemu.",
      "translation": "I remember something."
    }
  ],
  "pillars": {
    "secular-buddhist-philosophy": "Returning attention to a chosen practice depends on remembering the intention after the mind wanders.",
    "pre-industrial-wisdom": "An unwritten route or story survives when people remember and retell it."
  },
  "semantic_domains": {
    "cognition": "past experience or knowledge retained in or returned to present memory",
    "temporal": "a cognitive relation that links something past with the present"
  }
}
