{
  "word": "thela",
  "gloss": "how",
  "ipa": "/ˈθe̞.lä/",
  "syllables": [
    "the",
    "la"
  ],
  "pos": "interrogative",
  "search_terms": [
    "in what way",
    "manner question",
    "method question"
  ],
  "description": "'thela' seeks the manner or method of an action. With a state predicate, it asks how someone or something is. Quantity belongs to 'wia' (how many), not to 'thela'.",
  "articulatory_notes": "Let the tongue tip protrude lightly between the teeth for unvoiced 'th'. The airflow passes into unrounded 'e' at true-mid height. For 'l', contact the alveolar ridge with the tip but leave both sides open; finish with 'a' open and central. Stress the opening 'the'.",
  "sound_symbolism": "The careful interdental opening releases into the lateral flow of 'l'. That movement from friction to flow offers an embodied mnemonic for asking how a process makes its way.",
  "usage_notes": "'thela' sits where the manner or method would appear in an answer. The word already signals an open question, so 'wa' (Q) is absent. A content-question clause takes one gap-word.",
  "examples": [
    {
      "phi": "thia thela kealo.",
      "translation": "How do you create?"
    },
    {
      "phi": "thia thela nai.",
      "translation": "How are you?"
    }
  ],
  "pillars": {
    "pre-industrial-wisdom": "Craft knowledge often lives in demonstrated manner rather than in the finished object. 'thela' lets a learner ask for the process itself."
  }
}
