{
  "word": "kumoe",
  "gloss": "stomach",
  "ipa": "/ku.ˈmo̞.e̞/",
  "syllables": [
    "ku",
    "mo",
    "e"
  ],
  "pos": "noun",
  "description": "Food collects in 'kumoe', the muscular digestive organ that churns it and continues breaking it down before it passes onward. 'mokura' (belly) is the surrounding region, and 'nulomi' (guts) is the less exact collective term for abdominal inner workings.",
  "articulatory_notes": "Close the back of the tongue against the soft palate for unvoiced 'k' and release into high-back rounded 'u'. Close the lips for voiced 'm', carry the sound through the nose, and release into stressed middle-height back rounded 'o'. Move the tongue forward and unround into middle-height 'e' for the separate final syllable.",
  "usage_notes": "The noun identifies the organ rather than hunger, fullness, nausea, or pain. Those experiences are stated separately and can be located in the stomach when appropriate.",
  "examples": [
    {
      "phi": "kumoe mua mokura nai.",
      "translation": "The stomach is in the belly."
    }
  ],
  "semantic_domains": {
    "physical": "the muscular digestive organ that holds, churns, and continues breaking down food"
  }
}
