{
  "word": "wia",
  "gloss": "how many",
  "ipa": "/ˈwi.ä/",
  "syllables": [
    "wi",
    "a"
  ],
  "pos": "interrogative",
  "search_terms": [
    "how much",
    "what quantity",
    "quantity question",
    "number question"
  ],
  "description": "'wia' leaves a quantity gap for countable things and masses alike. An exact numeral, a bare-scale estimate, a quantifier, or a statement that the quantity is unknown can answer it. Before a noun, 'hina' (what) asks which one or kind; 'wia' asks how many or how much.",
  "articulatory_notes": "Round the lips as voiced 'w' begins; the back of the tongue remains high. Glide forward to unrounded high 'i'. Preserve the hiatus with a direct opening into central 'a' as a new syllable. Accent 'wi'.",
  "sound_symbolism": "The opening syllable is also the complete numeral 'wi' (two), a useful audible mnemonic for a quantity question. The final 'a' opens away from the numeral's high front vowel.",
  "usage_notes": "'wia' comes before the noun being counted or measured. One of Phi's four classifiers may appear between them, though the classifier remains optional. The word can occur alone when the referent is already clear. It cannot share its clause with 'wa' (Q). A content-question clause takes one gap-word.",
  "examples": [
    {
      "phi": "thia wia torua phelu.",
      "translation": "How old are you?"
    },
    {
      "phi": "thia wia phialu phelu.",
      "translation": "How much water do you have?"
    }
  ]
}
